[
  {
    "dateAndTime": "2026-02-11T10:19:00Z",
    "description": "Post game analysis of the victory.",
    "audio": "https://mundodolphins.es/audio/ep1.mp3",
    "imgMain": "https://mundodolphins.es/img/ep1_large.jpg",
    "imgMini": "https://mundodolphins.es/img/ep1_small.jpg",
    "len": "45:00",
    "link": "https://mundodolphins.es/episodes/1",
    "title": "Episode 1: The Victory"
  }
]
